{
  "spec_version": "v1.0",
  "decision_id": "c0000001-0000-4000-8000-000000000001",
  "timestamp": "2026-04-25T10:30:00Z",
  "decision_type": "scope.boundary",
  "decision": "allow",
  "reason": {
    "code": "SCOPE_VALID",
    "message": "All changed files are within declared workstream scope for 00-001-01",
    "details": {
      "changed_files": ["internal/x/foo.go", "internal/x/foo_test.go"],
      "scope_files": ["internal/x/foo.go", "internal/x/foo_test.go"],
      "drift_count": 0
    }
  },
  "context": {
    "request": {
      "action": "write",
      "resource": "internal/x/foo.go",
      "parameters": {"ws_id": "00-001-01"}
    },
    "actor": {"type": "agent", "id": "coder-agent", "roles": ["implementer"]},
    "environment": "production",
    "workstream_id": "00-001-01",
    "feature_id": "F001",
    "session_id": "sess-abc123"
  },
  "evidence": [
    {
      "type": "test_result",
      "reference": ".sdp/evidence/00-001-01-generation.json",
      "summary": "All 12 tests passing"
    },
    {
      "type": "review_approval",
      "reference": ".sdp/evidence/00-001-01-review.json",
      "summary": "Code review approved, 0 findings"
    }
  ]
}
